,jobtitle,jobdescription
287,IT Project Manager - Reservation Systems,"Overview The Project Manager will be in charge of overseeing multiple projects within the TravelClick Reservations platform. This includes, but is not limited to, project planning, estimating, execution, implementation, and ongoing support, based on an Agile-type delivery methodology. This is a 12+ month contract in Orlando, FL or New York, NY.The TravelClick Project Manager works closely with our engineering, QA, TechOps and product teams to guide projects and initiatives from conception to launch. As a Project Manager, you will be part of shaping the overall technology product direction, timelines, and budget. Our Comany:  TravelClick is the leading global provider of data, ecommerce and internet solutions to the hospitality industry. We have a dynamic and innovative work environment with a high level of growth opportunity. Headquartered in New York, TravelClick has a presence in North America, Barcelona, Singapore and Melbourne. The diversity of our teams' work experience and global perspective spans all offices.Our award-winning business solutions provide hosted websites and digital marketing services to thousands of hotels around the world. Our track record of innovation and performance has earned us and our clients over 200 website design awards since 2007 from the IMA, W3, WebAwards, Davey, and the HSMAI Adrian Awards.Responsibilities Principal Responsibilities:   * Management of the entire project life cycle for initiatives within the Reservations portfolio including discovery, planning, estimating, execution, implementation, UAT, certification, roll out, and ongoing support, based on an Agile-type delivery methodology * Ability to, individually and with a team, evaluate information gathered from multiple sources and translate into detailed project plans to provide a general understanding of the user requests and needs as they relate to a system changes, as well as the effect on business processes as a whole * Ability to elicit, analyze, and interpret business needs, requirements, and information supplied from multiple sources and departments * Act as a leader to ensure adherence to proper techniques and standard methodology relating to planning, communication, integration and implementation of work efforts, as well as contribution to best practices and continuous improvement * Collaborate with technical and business subject matter experts to establish the vision of projects and analyze the tradeoffs between performance needs and usabilityQualifications Desired Skills & Experience:   * Experience with blended Waterfall and Agile Project Management and Software Development Life Cycle * Experience delivering both software and infrastructure projects on time and on budget * Excellent verbal and written communication skills and the ability to interact professionally with a diverse group, including but not limited to executives, managers, and subject matter experts * Strong analytical skills required, including a thorough understanding of how to gather and interpret business needs and translate them into required project documentation. * Detail oriented and meticulous work ethic * Advanced experience with Microsoft Office suite including Word, Excel, PowerPoint, Project, and Visio * Experience with a mainstream Agile Project Management software product preferred * Can be based in New York, NY or Orlando, FL Education:   * Bachelor's degree * 5 - 7 years related experience and/or training preferred; equivalent combination of education and experience will be considered. #DICE #LI-YG1  Department: IT"
288,Senior Java Server Side/Front End Developer,"Client is looking for a senior Java developer to join the front office reference data technology team. Reference data is a key shared service and is used extensively by rates, credit, securitized products and other businesses, with a large set of requirements for strategic expansion. The team is responsible for design and development of a global system which acts as a front office view of instrument, book and counterparty data for trading, risk and pricing applications. This system enables Client to migrate our infrastructure and the organization from regional and business silos to a global cross-business solution which can accommodate current and expected growth. The candidate will be working on all components of the Reference Data system in areas which support the credit, rates, mortgages and equities businesses, and core software infrastructure. Responsibilities include:   * Implementation of software APIs used by other teams within Client * Assisting other technology teams with adoption these APIs and coming up with effective technical solutions * Implementation of real time indexing and context sensitive search services handling very large data sets (millions of records) * Implementation of services handling very large volumes of queries and updates * Development and configuration of intelligent caching and data distribution strategies * Improving the existing codebase and the software development process Technical skills required:   * 5 years of core Java server side programming experience on Unix/Linux platform. * Strong design skills and a deep understanding of design patterns and software development best practices * Expertise in service oriented architecture and design, messaging protocols, concurrent programming and relational databases * Experience with web technologies - JavaScript, HTML5 frameworks. * Experience with one or more Javascript MVC frameworks (AngularJS, Ember, Spine etc.) * Big pluses are a familiarity with distributed in-memory caching, C++, Spring and Maven The candidate must be a team player with good communication skills, and be able to work effectively within a global team Princeton Information is one of the nation's top five privately-held IT consulting firms, in business since 1985. Princeton Information services a clientele of primarily Fortune 500 companies nationwide. With annual revenues over $120 million, Princeton Information operates across the US from multiple regional offices. Our Commitment to Our Consultants As a privately held company, Princeton Information is solely committed to the success of clients and consultants - not to any shareholders. PI's success is grounded in the relationships we build with our consultants. We seek the best people; provide career path counseling; as well as the most challenging opportunities in business and in IT. As part of its culture of loyalty and commitment to its consultants, Princeton Information is committed to doing all we can to ensure our consultants have the best possible search, placement and work experience possible. Our Services Working with one Princeton Recruiter will gain you access to over 500 open requirements with the top clients in the US across all industries (finance, insurance, pharmaceutical, commercial, telecom, media, manufacturing) nationwide. Our local recruiters have in-depth knowledge of our clients and opportunities. They will work with you to find you the best possible opportunities for you and your career. Our Relationships Our relationships with our clients, as well as our consultants, are critical to our success! We have a robust sales organization that ensures that Princeton has the inside track on what attributes a person needs in order to be successfully placed and engaged at our clients. We know the technical and non-technical skills that our clients are looking for and we ensure that you are educated about the client prior to your interview with them. Princeton is committed to going above and beyond to ensure that each meeting you have with a client is a successful one!"
289,Test Technician,"TAD PGS, INC. is currently seeking a Test Technician for one of our clients in Evendale, OH. Company Description: A Forward thinking Fortune 500 company is building the world by providing capital, expertise and infrastructure for a global economy. They have provided billions in financing so businesses can build and grow their operations and consumers can build their financial futures. They build appliances, lighting, power systems and other products that help millions of homes, offices, factories and retail facilities around the world work better. One of the world’s largest companies is looking for someone like you to add to their family. Job Description: This Composites Lean Lab Technician will support the Composites Lean Lab subsection of the Advanced Technology Lean Lab section in the NPI Value Stream.It involves technical support of all composite materials and processes including planning, lay-up, cure, machining, and inspection.Plan and conducts associated projects requested by engineers/subsection leader.Perform required tasks including layup, cure, machining, inspection and documenting results.It will include running equipment required for composite processing.Perform tasks assigned by Operations Manager and technicians to manufacture aviation NPI composite parts.These tasks will include tool preparation, cutting and kitting of plyshape, hand layup, processing, inspection and assembly of composites parts and all operations associated with these directed tasks.Preferred Qualifications:Comfort level with reading gaugesDetail OrientedAbility to read and follow written proceduresQuestioning attitudeMechanical AptitudeWillingness to learn new skillsetsDependable and team orientedA level of craftsmanshipFlexible with multiple projects (priorities shifting)Able to work independently and self-motivatedComposite experienceResin Transfer Molding (RTM) experienceTAD PGS, INC. specializes in delivering secure, reliable and rapidly implemented workforce solutions to the U.S. Federal marketplace, including U.S. Government agencies and their prime contractors. With more than 50 years of experience, TAD PGS, INC. has earned a reputation for accountability, a value that government agencies and prime contractors both demand and deserve.TAD PGS, INC. sources professionals for the full spectrum of federal positions, from administrative to management, and those contracts requiring extremely niche-oriented technical skills and the highest levels of security clearance."
291,"Project Manager - CSP, Scrum Master, Certification, Coaching,.NET","Job Description: Our client is looking for a Project Manager (Scrum Master Sr.) in Phoenix, AZ Experience Certified Scrum Professional (CSP) designation for a minimum of 1 year. Candidates may also possess a Certified Enterprise Coach (CEC) designation for a minimum of 1 year or a Certified Scrum Master (CSM) designation for a minimum of 1 year. Hands-on experience in at least one of the roles on a Scrum Team (i.e., team member, scrum master or product owner). Coached in 3 or more organizations, departments, or programs. Have a minimum of 3 years and 2,000 hours of experience coaching at the enterprise/organizational level or a combination of enterprise and multi-team level coaching. Have a diversity of coaching experiences that can be demonstrated using different client engagement examples, and which include experience at the organizational level.Knowledge Have both formal and informal education about coaching and strong mentor relationships. Have a good working knowledge of Agile and Lean values, principles, and practices. Have helped individuals, teams, and leadership to understand and apply Agile and Lean values, principles, and practices effectively. Understand the dynamics, patterns, and development of multi-level teams and how they interact at the organizational level. Can clearly describe the difference between consulting and coaching and know when to apply each.Professional Collaboration Can provide two different client recommendations and one mentor recommendation to verify my coaching experience and skills. Have had active engagement in, contribution to, and leadership in, the Scrum community over a minimum of 3 years Have participated in at least 5 private or public Scrum- or Agile-related events and have contributed to some of these as an organizer, presenter, collaborator or facilitator.Skills Have contributed to significant improvements in organizations or departments through coaching techniques. Have helped organizations and teams beyond the basics of Scrum theory and practice. Have enabled organizations to find their own solutions to business problems through the application of Agile principles. Familiar with, promote and embody the mindset of Servant Leadership. Use a rich set of facilitation, training and coaching tools, and models.Additional Requirements:- Advanced experience with Team Foundation Server 2013 or later, VM Servers (5 years)- Advanced experience with .Net Programming (5 years)-Intermediate experience with JAVA and COBOL/Natural (3-5 years)-Advanced experience SQL Database (5 years)-Intermediate experience with ADABAS/DB2 (3 years)-Advanced experience with Project Management, Scrum, and Agile Waterfall (5 years)-Advanced experience with IT Testing, QA Processes-Intermediate experience with Mainframe (3 years)-Advanced experience with Distributed applcations (5 years)Required Skills: .NET; SCRUM. Don't hesitate! Submit your resume today. SMCI is an EEO employer. All qualified applicants will receive consideration without regard to race, color, religion, sex, pregnancy, national origin, disability, age, genetic information, veteran status, sexual orientation and identity, AIDS/HIV, medical condition, political activities or affiliations, or status as a victim of domestic violence, assault, or stalking. (No third parties, please)(H1 sponsorship currently unavailable)(Local candidates only, please)"
292,Software Developer,"ESSENTIAL FUNCTIONS:   "" Partner with employees and vendor partner consultants from different locations in the development and delivery of various software applications and enterprise services; e.g. Specialty, Home Delivery, Patient Systems, Claims, Corporate Systems. Works to develop skills, self-motivated, provides feedback to others, and oversees resolution of technical issues and complexities. Identify process improvement and code synergies achieved through innovative ideas and critical thinking. "" Consult with business departments as needed. Ensures projects/initiatives are completed within designated time frames and tracks progress reports to management. Acts as liaison between application development teams and across vertical partners to resolve issues, mitigate risks and monitor results. "" Leads resolution of urgent and on-going problems to ensure their team's contribution to overall reliability. "" Trusted advisor to Operations and cross-functional team members, providing data and technical insight from the application metrics, pertaining to business impact. "" Ensures defects are quickly assessed and/or mitigated and resolved in non-production and production environments. "" Represents Information Technology in cross-functional meetings and projects. Prepares for, implements, and communicates new corporate initiatives and processes within assigned team. QUALIFICATIONS:   "" College degree in Information Systems or related field, or equivalent work experience. "" Proven technical skills in high talent teams in local and remote locations. "" 3-5 years experience in software development, preferably 1-2 years at Client or in the PBM industry. "" Ability to be an agent of change, handle complex technical problems into smaller simple solutions, and create a culture that supports high team morale. "" Thorough knowledge of IT concepts, procedures and practices in the Software Development Life Cycle. "" Understanding of automated testing patterns such as unit testing, mocking and automated integration testing. "" Knowledge of testing technologies such as Junit, EasyMock, Mockito, Cucumberand Selenium is a plus. "" Demonstrated knowledge of Agile process, Dev/Ops related practices/tools, test automation, and overall CI/CD based iterative development as it applies to software delivery. "" Spring/SpringBoot, Pivotal Cloud Foundry, RESTful microservices design, MQ, Pega, SOFEA/ MULE, Java, J2EE, Oracle forms, Oracle PL/SQL, DB2, DataPower, Eclipse and Jenkins "" Monitoring instrumentation using Graphite and Splunk "" Real world experience using architectural and design patterns such as OOP, MVC, IoC, and AOP to improve code structure and maintainability. "" Mainframe development experience is a plus "" Advanced problem solving skills and the ability to work collaboratively with other departments to resolve complex issues with innovative solutions. "" Demonstrated ability to prioritize work load and meet project deadlines. "" Experience with strategic work planning and budgeting. "" Ability to adapt in a dynamic work environment and make independent decisions. "" Strong customer service focus. "" Excellent communication skills, written and verbal. "" Familiarity with health care or PBM industry very helpful. "" Willingness to work a flexible schedule to accommodate project deadlines. "" Willingness to travel as needed. Princeton Information is one of the nation's top five privately-held IT consulting firms, in business since 1985. Princeton Information services a clientele of primarily Fortune 500 companies nationwide. With annual revenues over $120 million, Princeton Information operates across the US from multiple regional offices. Our Commitment to Our Consultants As a privately held company, Princeton Information is solely committed to the success of clients and consultants - not to any shareholders. PI's success is grounded in the relationships we build with our consultants. We seek the best people; provide career path counseling; as well as the most challenging opportunities in business and in IT. As part of its culture of loyalty and commitment to its consultants, Princeton Information is committed to doing all we can to ensure our consultants have the best possible search, placement and work experience possible. Our Services Working with one Princeton Recruiter will gain you access to over 500 open requirements with the top clients in the US across all industries (finance, insurance, pharmaceutical, commercial, telecom, media, manufacturing) nationwide. Our local recruiters have in-depth knowledge of our clients and opportunities. They will work with you to find you the best possible opportunities for you and your career. Our Relationships Our relationships with our clients, as well as our consultants, are critical to our success! We have a robust sales organization that ensures that Princeton has the inside track on what attributes a person needs in order to be successfully placed and engaged at our clients. We know the technical and non-technical skills that our clients are looking for and we ensure that you are educated about the client prior to your interview with them. Princeton is committed to going above and beyond to ensure that each meeting you have with a client is a successful one!"
293,Solutions Architect,"Our client, the leading loan servicing provider, is seeking a Solutions Architect .   Location: Ewing, NJ or Lower Makefield , PA Position Type: Full Time   Essential Functions: - The Solution Architect will identify and execute on strategies that enhance the value of   the department’s technology solutions that position the company   favorably for growth. - The Solution Architect will work with a cross functional team in designing, planning, developing and implementing initiatives around both new and existing technology products alike. - He or she will be responsible for managing the life cycle and portfolio of the department’s technology initiatives, and   must have a proven background in successfully delivering technology initiatives.   - The position will require demonstrated experience in managing software vendors.   Job Responsibilities: - Translate department vision into roadmap items and technical solutions. - Define, manage, and implement roadmap items - Provide technical guidance and consulting from strategy to planning to issue resolution - Design systems and solutions, liaise between Technology and business teams - Review technical events, issues, and problems as contributions to ‘continuous improvement’ revisions to the technical strategy - Communicate business objectives and requirements to software vendors and internal development teams clearly and effectively. - Use and develop SME knowledge to understand business objectives and evaluate requirements, conduct functional design and gap analysis across data warehouse, reports, dashboards, and metrics - Explain existing system capabilities to key business users. Leverage existing capabilities into solutions - Become the business SME representative for technical questions    - Serve as a liaison to the business area to incorporate technical requirements to design solutions for business needs - Define scope and requirements, isolate key issues, review possible solutions, and present recommendations - Work with the development, architects, QA, and business teams to implement new solutions and enhancements to existing solutions - Review documentation provided by vendors and internal technical analysis teams for technical accuracy in meeting the business needs and conforms to solution design - Understand and mitigate the technical design on security, performance and data privacy through reviews of proposed configurations and system implementations - Ability to work collaboratively with IT and business leadership to contribute to strategy and implement it successfully   Requirements: - Minimum 5 years of Technology Systems experience. - Strong analytical, organizational and problem-solving skills. - Demonstrated expertise designing and delivering technology solutions in a cross-functional environment. - Proven ability to manage multiple projects and initiatives. - Proven ability to work independently and interface with all levels and functions of an organization. - Demonstrated ability to facilitate communications across cross-functional teams. - Demonstrated ability to influence and implement both tactical and strategic programs with key internal partners and vendors. - Ability to multi-task in a demanding and deadline-driven environment with minimum supervision. - Demonstrated ability to manage multiple tasks and relationships. - Desire to roll up sleeves and get your hands dirty. - Self-starter, entrepreneurial, highly motivated, ""get-the-job-done"" type. - Excellent verbal and written communication skills. - Background in mortgage, financial services or banking environment, and familiarity with regulatory and technology risk requirements preferred. - Familiarity and experience in data protection and information security. - Direct experience in implementing data management processes, procedures and data quality management. - Strong understanding of data Architecture and Security. - Experience dealing with both structured, unstructured and semi-structured data is required.  "
