,jobtitle,jobdescription
223,JavaScript Web Programmer Analyst,"Banking client in Getzville, NY is looking for JavaScript Web Programmer Analyst for a long term contract. Description Business/Department Overview The Graphic Communications Department is a full-service support that is a fast-paced, customer-oriented production environment servicing clients within Client. It consists of Print Design and web-based products, distribution solutions and services. Responsibilities:   * Manager is willing to accept candidates that have 1 to 2 years of experience - candidates recently out of University with this experience would be a great fit * The requirements and responsibilities for all aspects of this role include (but are not limited to) the following: * This position requires demonstrated mastery of modern web-development techniques and prior experience working with medium- to large-scale websites under deadline. A list demonstrating a history of web development projects is a must. * The best candidate will have a proven history with website development and an excellent understanding of web standards working in a business environment. A successful candidate must be organized, detail oriented, diplomatic and responsible. Requirements:   Candidate must be tested. Education:   Four-year college degree is a MUST (COMPUTER SCIENCE DEGREE) * Must submit portfolio sample/ link with resumes submissions. Resumes without portfolios will not be considered - THIS IS A MUST! * Excellent communication skills - THIS IS A MUST! - candidate must speak clearly and have excellent communication skills * Must have relevant professional work experience * Must have some experience with client interaction * At least four years' experience hand-coding HTML, XHTML, CSS (Table-less layout) and JavaScript (able to modify existing scripts) FLASH * Actionscript is a plus * Extensive experience working on tight deadlines in fast-paced environments * Extremely detail oriented, self-motivated and disciplined * Experience using Photoshop for image slicing and optimization * Familiar with web standards and cross-platform, cross-browser issues * Experience developing and testing across multiple browsers, platforms Programming, Scripting, & Database Languages: * PHP, JavaScript / JQuery, HTML, CSS, C#, Python, R, SQL / MYSQL as well as the use of several API's including Google / Google analytics, Twitter, Facebook, Yelp, wrike, salesforce, and mandrill. Frameworks:   Codeigniter, laravel, kohana (PHP), flask (python), bootstrap (CSS / JavaScript), and skeleton (CSS) Tools:   Microsoft SQL server management studio, redmine, Adobe Photoshop, and Wordpress Environments:   Experience developing and deploying applications and / or websites in windows, linux, and mac os x environments. Need to submit resume with JavaScript Proveit score Please also note - this is not a graphic designer role - this is a JavaScript programming role We want to see portfolio's to their code. JavaScript is the primary skill and most important Thank you for your interest... For immediate consideration please contact Syed Uddin at syed.uddin@princetoninformation.com or 201-205-2295. For a full listing of our available job openings, please visit our website at www.princetoninformation.com Princeton Information is one of the nation's top five privately-held IT consulting firms, in business since 1985. Princeton Information services a clientele of primarily Fortune 500 companies nationwide. With annual revenues over $120 million, Princeton Information operates across the US from multiple regional offices. Our Commitment to Our Consultants As a privately held company, Princeton Information is solely committed to the success of clients and consultants - not to any shareholders. PI's success is grounded in the relationships we build with our consultants. We seek the best people; provide career path counseling; as well as the most challenging opportunities in business and in IT. As part of its culture of loyalty and commitment to its consultants, Princeton Information is committed to doing all we can to ensure our consultants have the best possible search, placement and work experience possible. Our Services Working with one Princeton Recruiter will gain you access to over 500 open requirements with the top clients in the US across all industries (finance, insurance, pharmaceutical, commercial, telecom, media, manufacturing) nationwide. Our local recruiters have in-depth knowledge of our clients and opportunities. They will work with you to find you the best possible opportunities for you and your career. Our Relationships Our relationships with our clients, as well as our consultants, are critical to our success! We have a robust sales organization that ensures that Princeton has the inside track on what attributes a person needs in order to be successfully placed and engaged at our clients. We know the technical and non-technical skills that our clients are looking for and we ensure that you are educated about the client prior to your interview with them. Princeton is committed to going above and beyond to ensure that each meeting you have with a client is a successful one!"
224,JDA Developer,"JDA Developer Location:   Parsippany, NJ Full Time Technical Knowledge/Skills * Proven ability to develop applications in multiple programming environments is required. * Expert knowledge of security requirements, web services, service-oriented architecture, design patterns, multi-threaded systems, and automated unit testing. * Expert knowledge of application development, testing and programming techniques/languages. * Experience in JDA Foundation v7.6, 8.x * Experience in JDA SCPO v7.6 & above * Experience in JDA Demand & Collaborate v7.6 and above * Experience in JDA Master Planning v7.6, Enterprise Supply Planning v8.x * Experience in JDA Sequencing v7.6 and above * Experience in JDA Fulfillment v8.x * Database Technology Oracle 11g, 12c * Experience in JDA SCPO & Sequencing upgrade from v7.6 to 8.x * Proficient in writing SQL scripts including PL/SQL * Proficient in writing Windows command scripts * Proficient in Java and .Net technology * Experience working with Supply Chain Management modules within ERP such as Peoplesoft a plus Advanced knowledge of Information Security Awareness. Good knowledge of General Project Management Methodology & Tools. Education/Experience Bachelor's Degree in Computer Science, Information Systems, or other related field 12+ years of IT and business/industry work experience 12+ years experience in programming across multiple technologies and platforms 10+ years experience with data analysis, design and implementation, including working with end users to effectively assess business requirements and define programming needs to support redesigned processes 7+ years experience in systems analysis and design with proven record of successful large scale project implementations Thank You Mohammed Aqil 201-479-9903 Princeton Information is one of the nation's top five privately-held IT consulting firms, in business since 1985. Princeton Information services a clientele of primarily Fortune 500 companies nationwide. With annual revenues over $120 million, Princeton Information operates across the US from multiple regional offices. Our Commitment to Our Consultants As a privately held company, Princeton Information is solely committed to the success of clients and consultants - not to any shareholders. PI's success is grounded in the relationships we build with our consultants. We seek the best people; provide career path counseling; as well as the most challenging opportunities in business and in IT. As part of its culture of loyalty and commitment to its consultants, Princeton Information is committed to doing all we can to ensure our consultants have the best possible search, placement and work experience possible. Our Services Working with one Princeton Recruiter will gain you access to over 500 open requirements with the top clients in the US across all industries (finance, insurance, pharmaceutical, commercial, telecom, media, manufacturing) nationwide. Our local recruiters have in-depth knowledge of our clients and opportunities. They will work with you to find you the best possible opportunities for you and your career. Our Relationships Our relationships with our clients, as well as our consultants, are critical to our success! We have a robust sales organization that ensures that Princeton has the inside track on what attributes a person needs in order to be successfully placed and engaged at our clients. We know the technical and non-technical skills that our clients are looking for and we ensure that you are educated about the client prior to your interview with them. Princeton is committed to going above and beyond to ensure that each meeting you have with a client is a successful one!"
225,Developer - PHP LAMP MVC MSQL OOD,"Job Description: 3+ years working with PHP 5.3+ on a Linux environment such as RedHat, Centos, or Fedora. 3+ years writing code within an MVC framework, preferably Zend Framework. 5+ years working with relational databases (preferably PostgreSQL), writing complex queries with multiple joins, triggers, and stored procedures. 3+ years experience with HTML, CSS, PHP, Javascript Proficiency with Design Patterns and object-oriented programming including implementation. Experience implementing: o RESTful Web Services and APIso Unit testing, Test Driven Developmento Continuous integrationo Scripting languages such as bash, perl, python Proficiency with GIT version control including per-project branching and mergingSkills Desired Prior biotech or healthcare experience preferred Experience using PostgreSQL AngularJS, JavaScript, and jQuery The Laravel framework The ability to work effectively in collaborative, team based environments A track record of continuous improvementRequired Skills: PHP OOD LAMP MVC MSQL. Don't hesitate! Submit your resume today. SMCI is an EEO employer. All qualified applicants will receive consideration without regard to race, color, religion, sex, pregnancy, national origin, disability, age, genetic information, veteran status, sexual orientation and identity, AIDS/HIV, medical condition, political activities or affiliations, or status as a victim of domestic violence, assault, or stalking. (No third parties, please)(H1 sponsorship currently unavailable)(Local candidates only, please)"
226,"Systems Analyst - Healthcare Claims, ERISA, COBRA, HIPAA. SQL, SDLC","Job Description: Our Burbank Client is looking for a passionate Business Analyst - Healthcare Claims to turn data into information, information into insights and insights into business decisions.The Business Analyst Healthcare Claims will partner with stakeholders across the Claims Department using a variety of large data sources, including healthcare and pharmacy claims while working closely with Claims Management to prioritize, analyze, design, develop, modify and test reports and solutions to support the Funds Claims business.The Business Analyst Healthcare Claims will consult with the business and leverage their industry knowledge and experience as a subject matter expert to work to propose solutions across all related systems (Vitech Claims system, vendor systems, data warehouse, etc.). This is an excellent opportunity for the right candidate to influence the development of innovative solutions in the rapidly growing and changing Healthcare Industry and Multiemployer health plans.Required Skills: SQL; Of ERISA, COBRA, and HIPAA; Health Claims Adjudication, Healthcare and Mental Health Regulations, Health Insurance Eligibility and Pharmacy.. Don't hesitate! Submit your resume today. SMCI is an EEO employer. All qualified applicants will receive consideration without regard to race, color, religion, sex, pregnancy, national origin, disability, age, genetic information, veteran status, sexual orientation and identity, AIDS/HIV, medical condition, political activities or affiliations, or status as a victim of domestic violence, assault, or stalking. (No third parties, please)(H1 sponsorship currently unavailable)(Local candidates only, please)"
227,Micro-services Developer,"Our client is seeking a Micro-services Developer .   Location: Long Island City, NY Position Type: Contract   -In this role you will develop and launch new mobile products and extend platform functionality as part of our next generation strategy. -You will work closely with product management, technical program managers, designers and other engineers to define design approaches, prototype new technologies and evaluate technical feasibility to deliver value to our customers. -We care about building high-quality software flexible and robust enough to maintain balances and handle transactions across a variety of account types for millions of customers with the integrity expected of state of the art financial systems. -Innovation with these scaling and security constraints provides a unique set of opportunities. -We dive deep to insist on the highest standards in architecting, coding, testing, deploying and maintaining every aspect of our offerings. -If you’re thrilled by the idea of ownership, passionate about creating new features and services from scratch, and think you can manage the ambiguity and pace, we would love to connect with you.   POSITION RESPONSIBILITIES: -Work collaboratively with product management, UX designer, governance and your scrum team to design and deliver new and innovative customer solutions. -Bring to bear your experience leveraging best in class tools and technologies (CI/CD, cloud computing, web service development) to refine and improve software development practices for your team. -Engage in innovative problem solving activities, requiring conceptual thinking creating 'out of the box' solutions with prototypes and pilots. -Utilize TDD practices to ensure delivery of high quality code with low rates of production defects. -Instrument services and solutions to ensure deployed software is scalable and reliable.   BASIC QUALIFICATIONS: -Bachelor’s Degree in Computer Science or related field and 2+ years commercial coding experience -Strong fundamentals in object-oriented design, data structures, algorithms, problem solving, and complexity analysis -Experience with distributed systems, caching and persistence solutions -Ability to troubleshoot and identify the root cause of issues under time pressure -Ability to effectively articulate technical challenges and solutions -Excellent interpersonal communication with strong verbal / written English skills -Demonstrated skill and passion for operational excellence -Customer–focused mindset, taking pride in creating an informative data-driven journey   PREFERRED QUALIFICATIONS: - Keys are:  Strong Java, Pivotal Cloud Foundry or AWS, Caching/ Gemfire , Oracle and Tibco is a plus -Knowledge and/or experience with micro services (Sprint Boot, GemFire , Undertow etc.) is a plus -Knowledge and/or experience with cloud-based development with Pivotal Cloud Foundry or AWS is a plus -Commercial development experience in financial or related industries -Experience building localized, multi-tenant solutions -18+ months experience building software with PCF and Gemfire -18+ months experience building software for iOS, Android  "
228,Electrical Project Engineer,"TAD PGS INC. is currently seeking an Electrical Project Engineer for one of our clients in Frederick, MD.up to 100K + BonusLocal Candidates ONLYJob Overview: Develop technical solutions in conjunction with the customer to promote the company product line, market acquisition, and revenue. The company designs and manufactures solid insulated bus bars types and cast-resin insulated bus bars representing a reliable new technical solution in the field of safe energy distribution. Job Responsibilities:Assess customer product/market needs and provide best solution sets including manufacturability requirements and maximizing value propositionLiaise with technical colleagues, US and International, to determine product specification and costsLead projects/accounts to resolve technical issues and maximize value propositionApply appropriate design/engineering standard to designs ensuring compliance with applicable regulations and standardsFrequently travel to customer site to develop solutions and resolve technical issuesDetermine and develop new products and process with company Group to meet market demandAssist in presenting training programs to select customers and distributorsSupport actions to increase effective market coverage of company productsRequired Qualifications:sBachelor’s Degree in Engineering discipline (Electrical)Experience in medium voltage power distributionSit for long durations of time (up to 8 hours)Work at computer and keyboard for majority of work time using hands and fingersAbility to lift up to 50 lbs. to waist level; up to 25 lbs. above shouldersFrequent travel (up to 50%) to current and prospective customersAbility to work in a fast paced environment and adapt to frequent assignment changesStrong conversational and persuasive skillsWorking knowledge of Microsoft Office productsExperience in Project Management Desired Qualifications:Experience in make-to-order engineering environment preferredExperienced with long sales cycleExperience in low volume manufacturing environment preferredTAD PGS, INC. specializes in delivering secure, reliable and rapidly implemented workforce solutions to the U.S. Federal marketplace, including U.S. Government agencies and their prime contractors. With more than 50 years of experience, TAD PGS, INC. has earned a reputation for accountability, a value that government agencies and prime contractors both demand and deserve.TAD PGS, INC. sources professionals for the full spectrum of federal positions, from administrative to management, and those contracts requiring extremely niche-oriented technical skills and the highest levels of security clearance."
229,Sr Software Staff UI Engineer,"SENIOR SOFTWARE / STAFF UI ENGINEER – HEAT CLOUDAre you looking for a challenge and the opportunity to be part of building a new enterprise cloud application in the End Point, Service, IT Management space from the ground up? HEAT Software builds the world’s most powerful fusion of flexible, advanced and secure, service and unified endpoint management solutions.As a Senior Software Engineer, you will be joining HEAT Cloud UI Services team to provide key contributions to the development and Integration of various UEM and SM products. You will take responsibility for developing HTML 5 based modern front end UI and the overall Client Side architecture/design of the product. In this position, you will analyze requirements, contribute in defining the architecture, produce design documentation and implement the design. You’ll need strong working knowledge of highly secured, scalable web-based applications with the ability to convey your understanding of the intricacies of the system. RESPONSIBILITIES:Test Driven Development of responsive Modern Web UI using JavaScript libraries like Angular JS, Typescript, Sencha ExtJS 6, React, Backbone and EmberDefine client architecture, Build client framework, create technical designs and develop new product features using best practicesDevelop state of the art, attractive UI, and intuitive User Experience using CSS Preprocessor frameworks like SASS, LESSProvide guidance to cross-functional/organizational team membersDocument code at a level that provides a standard for other Engineers/TestingSupport the application to go through the full lifecycle for SaaS delivery Competencies / QUALIFICATIONS:Bachelor’s / Master's degree in Computer Science or related field or equivalentMinimum 4-6 years of experience using JavaScript frameworks, HTML 5, CSS 3 and similar technologiesAt least 4-6 years of experience in client web technologiesExperience in frameworks like Angular JS, Sencha ExtJS 6 MVVMExperience in REST / OData Web services with JSONExperience with Test Driven Development on client sideStrong Object Oriented Design skillsStrong Computer Science fundamentals – Algorithm, Data Structure, Design patterns In depth understanding and expert experience in building modern Cloud web applicationsAttention to detail, high degree of accuracy in daily work, ability to work independently and meet deadlinesStrong analytical and problem solving skills DESIRED:Experience in building Cloud multi-tenant applicationsSaaS product development / implementation experienceExperience in MS IIS and SQL ServerExperience with object oriented languages such as C# or Java"
230,Middleware Developer,"MQ Middleware Support Consultant with one of our premier financial clients in Raleigh, NC. Responsibilities:   "" Participate as an active member of the worldwide Middleware support team and take position in off-hours support / The support team monitors and assures the stability of the production environments worldwide and provides support to the firms application developers. "" In addition to monitoring the existing systems, the support team members must also build and customize existing environments. The support aspect of this role requires knowledge of many technologies. We need to support the operational systems and the developers. "" Become proficient in all company Messaging Technologies (B2B, Foboca, OMB, EMS etc...) "" Participate in the Global Oncall Rotation "" Comply with all team processes and Standards "" Complete Projects as assigned by the team leader Required Skills:   "" Solid technical background in WebSphere Message Broker and/or IBM MQ/WebSphere MQ. Experience with Linux and Solaris/Unix is essential. "" Applicant must be a quick learner. Good familiarity with technical architecture concepts. Strong research and information gathering skills. Good business/technical writing skills for requirements communication, knowledge transfer and status reporting Ability to work on own initiative, researching and following up issues is important.. "" Knowledge of Geneos or BMC Monitoring products (Configuration and Administration) is Preferable "" Knowledge of Codestreet Replay Service a plus "" Demonstrated leadership skills. Excellent communication skills a must "" TIBCO EMS Experience is a plus Princeton Information is one of the nation's top five privately-held IT consulting firms, in business since 1985. Princeton Information services a clientele of primarily Fortune 500 companies nationwide. With annual revenues over $120 million, Princeton Information operates across the US from multiple regional offices. Our Commitment to Our Consultants As a privately held company, Princeton Information is solely committed to the success of clients and consultants - not to any shareholders. PI's success is grounded in the relationships we build with our consultants. We seek the best people; provide career path counseling; as well as the most challenging opportunities in business and in IT. As part of its culture of loyalty and commitment to its consultants, Princeton Information is committed to doing all we can to ensure our consultants have the best possible search, placement and work experience possible. Our Services Working with one Princeton Recruiter will gain you access to over 500 open requirements with the top clients in the US across all industries (finance, insurance, pharmaceutical, commercial, telecom, media, manufacturing) nationwide. Our local recruiters have in-depth knowledge of our clients and opportunities. They will work with you to find you the best possible opportunities for you and your career. Our Relationships Our relationships with our clients, as well as our consultants, are critical to our success! We have a robust sales organization that ensures that Princeton has the inside track on what attributes a person needs in order to be successfully placed and engaged at our clients. We know the technical and non-technical skills that our clients are looking for and we ensure that you are educated about the client prior to your interview with them. Princeton is committed to going above and beyond to ensure that each meeting you have with a client is a successful one!"
