,jobtitle,jobdescription
158,Position Type: IT-Contract,"General Comments Why is this position available? Is it because of company growth? Someone left or was fired? Restructuring?   How long has it been open?   What business challenge is this addressing?   Non-Tech Skills (communication, problem solving):   What is the interview process?   Are other managers interviewing?   Who else is working on it?   Is there anyone in the past that has worked for you that you would consider rehiring? Likes/dislikes for previous candidates?   Enter ""with whom, when, and how"" interviews will take place (connected to the requisition (include any planned vacations for those involved in the process)  "
159,Android Developers,"Our client, one of the largest financial services firms, is seeking an Android Developers. Location: Irving, TX Position Type: Contract Job Details: -We are searching for a certain kind of person who is excited by the idea of owning; people who like to build new platforms, features and services.  -This position requires collaboration with UX designers, product managers, technical program managers, and partner teams.  -You should be comfortable with ambiguity with a desire to create, iterate and improve. -In this role you will develop and launch new mobile products and extend platform functionality as part of our next generation strategy.  -You will work closely with product management, technical program managers, designers and other engineers to define design approaches, prototype new technologies and evaluate technical feasibility to deliver value to our customers.  -We care about building high-quality software flexible and robust enough to maintain balances and handle transactions across a variety of account types for millions of customers with the integrity expected of state of the art financial systems.  -Innovation with these scaling and security constraints provides a unique set of opportunities.  -We dive deep to insist on the highest standards in architecting, coding, testing, deploying and maintaining every aspect of our offerings.  -If youre thrilled by the idea of ownership, passionate about creating new features and services from scratch, and think you can manage the ambiguity and pace, we would love to connect with you.   Position responsibilities:  -Work collaboratively with product management, UX designer, governance and your scrum team to design and deliver new and innovative customer solutions. -Bring to bear your experience leveraging best in class tools and technologies (CI/CD, cloud computing, web service development) to refine and improve software development practices for your team. -Engage in innovative problem solving activities, requiring conceptual thinking creating 'out of the box' solutions with prototypes and pilots. -Utilize TDD practices to ensure delivery of high quality code with low rates of production defects. -Instrument services and solutions to ensure deployed software is scalable and reliable. Basic qualifications: -Bachelors Degree in Computer Science or related field and 2+ years commercial coding experience -Strong CS fundamentals in object-oriented design, data structures, algorithms, problem solving, and complexity analysis -Experience with distributed systems, caching and persistence solutions -Ability to troubleshoot and identify the root cause of issues under time pressure -Ability to effectively articulate technical challenges and solutions -Excellent interpersonal communication with strong verbal / written English skills -Demonstrated skill and passion for operational excellence -Customer-focused mindset, taking pride in creating an informative data-driven journey Preferred Qualifications:  -Commercial development experience in financial or related industries -Experience building localized, multi-tenant solutions -18+ months experience building software with PCF and Gemfire -18+ months experience building software for iOS, Android."
160,Java Developer,"Our cli ent, major bank which monitors the monetary policy, financial supervision and the payments system, is seeking a Java Developer.   Location: New York, NY Position Type: Contract   Qualifications: - This position is limited to ""Protected Individuals"" as defined in the U.S. federal immigration law. - Protected Individuals includ e, but are not limited to, U.S. citizens, U.S. nationals, U.S. permanent residents who are not yet eligible to apply for naturalization, and U.S. permanent residents who have applied for naturalization within six months of being eligible to do so. - The submitted candidate must be able to obtain National Security Clearance if required.   Top 5-10 technical skills required for the job: - Advanced-level experience with Java, Spring, JUnit, Maven, Ant, Apache Tomcat and HTTP - Comfortable using Test Driven Development to build fle xible, high quality software - Strong analytical and problem-solving skills, able to work independently to resolve des ign and technical challenges - Ability to understand business requirements and appropriately translate them to technical an d functional requirement - Experience building networked software in a highly secure environment. Bachelor’s degree in Computer Sciences or related discipline o r equivalent work experience - Advanced-level experience with Java, Spring, JUnit, Maven, Ant, Apache Tomcat and HTTP - Comfortable using Test Driven Development to build fle xible, high quality softw are - Strong analytica l and problem-solving skills - Ability to understand business requirements and appropriately translate them to technica l and functional requirement - Experience building networked software in a highly secure environment - Ability to work independently or as part of a team and to balance multiple project s and conflicting priorities - Strong interpersonal skills, including the ability to interact with all levels of management, local and national support staff, customers, and external vendors - Proven project planning skills in effectively meeting deadlines on individual assignments, knowledge and ex perience with Scrum desirable - Working knowledge of Windows 7, OS X , and Linux operating systems -Experience using Eclipse - Working knowledge of HTML, CSS and JavaScript, as well as related APIs and frameworks, for exam ple Bootstrap, jQuery and D3 - Experience with Solr , Lucene, Hadoop H DFS, Spark, Flume, and Ka fka - Hands-on implementation experience wi th one or more of the following authentication/ authorization technologies: SAML, OAuth   Responsibilities: - Design and plan search implementation based on business requirements for enterprise search functionality against a large volume of unstructured, semi-structured and structured informati on - Design and develop components to extract and index content from enterprise repositories - Provide ongoing support of search system including search indices, crawl ers, connectors, feeds, etc. - Create written documentation including project plans, policy and procedure, presentations, and other documents as necessary - Participate in local security and national Security Assurance for the Risk Assessment Project for pertinent technologies and deve lop supporting documentation - Provide technical consulting for lines of business and other support staffs on web infr astructure and related services"
161,Systems Administrator (VMware / Red Hat Linux),"Trigyn's direct financial client has an immediate opening for Systems Administrator in Montreal, Canada.Description:The client is looking for a systems administrator with experience in managing backup and recovery systems, building automation, tooling and processes for plant management. The consultant will be liaising working with global engineering teams and disaster recovery coordinators. The work would involve working across a broad range of technologies, a willingness to dive into unfamiliar technologies rather than any specific niche. Technologies will span hardware, software, proprietary as well as open-source. Furthermore, the role requires independence, primarily working with groups in remote offices.Skills Required: Experience with KVM, ESX or other virtualization management infrastructure. 3 to 5 years experience of system administration practices, primarily Red Hat Linux. Writing maintainable scripts with Perl and/or Python. Ability to plan, organize, prioritize, and complete assigned tasks with minimal supervision despite rapidly changing priorities. Project management skills for coordinating teams coming to the labs. Experience with NetBackup.Skills Desired: Experience with network security practices. Ability to manage projects. Education Level: Bachelor's DegreeNO THIRD PARTY CANDIDATES PERMITTED.PLEASE RESPOND ONLY IF YOU ARE CURRENTLY ELIGIBLE TO WORK IN CANADA.TRIGYN TECHNOLOGIES, INC. is an EQUAL OPPORTUNITY EMPLOYER and has been in business for 30 years. TRIGYN is an ISO 9001:2008, ISO 27001:2013 (ISMS) and CMMI Level 3 certified company. TRIGYN is an E-Verify* Employer."
162,Program Scheduler V,"TAD PGS, INC. is currently seeking a Program Scheduler V for one of our clients in Dulles, VA. Company Description: An aerospace and defense enterprise that focuses on revising defined worker policy, standardizing management processes, improving oversight & tightening financial controls. We have over 25 years of successful collaboration in developing and producing innovative and affordable technologies. Join us today, we are “The Partner You Can Count On”! Job Description: Provide focused planning and scheduling support to the Mechanical and Electrical Engineering Directorates within the Space Systems Group. Under the direction of the department leads, provide planning/scheduling support to the Propulsion Work Center and Environmental Test Bay to plan build and test activities, identify and forecast necessary resources, identify and resolve resource conflicts (personnel and equipment) to optimize and accurately forecast the throughput through the work center and test bay. Work with the Electrical Engineering Directorate to identify and prioritize tasking, determine available resources, and resolve conflicts within the group to provide an accurate forecast of the completion of engineering products to support program execution needs. Interface with program management and scheduling personnel to identify program requirements and need dates for Work Center, Test Bay, and Engineering products. Additional opportunities to support space system program execution, capital and internal research and development projects and facilities planning needs are available. Basic Hiring Criteria: Bachelors degreeDesired Qualifications:MS Project Expertise Direct involvement with project schedule development, management, execution (not just oversight/supervision).Hardware Production/integration, assembly and test experience preferred.Experience in a hardware-related (manufacturing/assembly/test) environment.MS Project is their primary tool, with knowledge and experience in Primavera (again, this is an MS Project job).Expert working knowledge with Microsoft Project 2010/2013 and MS Office products is required.The ability to learn new tools and data analysis and presentation methods in an ""on-the-job"" training environment is also necessary.Familiarity with scheduling in a hardware production environment is preferred.Working knowledge of other scheduling tools (Primavera P6, Open Plan) is a bonus.TAD PGS, INC. specializes in delivering secure, reliable and rapidly implemented workforce solutions to the U.S. Federal marketplace, including U.S. Government agencies and their prime contractors. With more than 50 years of experience, TAD PGS, INC. has earned a reputation for accountability, a value that government agencies and prime contractors both demand and deserve.TAD PGS, INC. sources professionals for the full spectrum of federal positions, from administrative to management, and those contracts requiring extremely niche-oriented technical skills and the highest levels of security clearance."
163,Sales Support Analyst,"TAD PGS, INC. is currently seeking a Sales Support Analyst for one of our clients in Nashville, TN. Job Overview: Support sales organization through customer, operational and business support. Responsible for serving as primary interface between sales and other operational functions developing sales processes and procedures relating to online/offline order administration, order fulfillment and communication. Evaluates and implements improvements to sales programs and processes including: anticipating demands, account management, leads, planning and prioritization, closing strategies, pricing and margin strategies, sales automation, tools and reporting programs. Primary Responsibilities: Provides pre-sales and/or post-sales operational support.Manages order fulfillment.Researches customer or order problems, and delivers solutions working cross-functionally to resolve.Liaises between the customer/partner and sales organization.Focuses on delivering a positive customer or partner experience.Facilitates product and sales information flow.Drives sales operations process improvements.Serves as interface for order status and handles order escalation and SKU management.May serve as primary interfaces with other internal functions, based on BU and/or regional requirements.May be responsible for influencing sales behavior and capabilities.Demonstrates knowledge of internal operations and develops relationships to facilitate workflow.Applies specialized knowledge to coordinate day-to-day workStrong understanding of current process and procedures and may identify opportunities for improvementCompletes a wide range of tasks and assignments.Projects and assignments are typically non-routine and variable in nature.Resolves more complex situations by applying demonstrated knowledge and skill generally acquired through job experience Basic Hiring Criteria:High School diploma or equivalent required. Associates degree, technical college, or some college course work preferred.Work experience: 2-4 years’ experience Desired Qualifications:Understands how work impacts results for their areaKnowledge of related regulations and standardsEstablished working knowledge and application of a specialized technical skillTAD PGS, INC. specializes in delivering secure, reliable and rapidly implemented workforce solutions to the U.S. Federal marketplace, including U.S. Government agencies and their prime contractors. With more than 50 years of experience, TAD PGS, INC. has earned a reputation for accountability, a value that government agencies and prime contractors both demand and deserve.TAD PGS, INC. sources professionals for the full spectrum of federal positions, from administrative to management, and those contracts requiring extremely niche-oriented technical skills and the highest levels of security clearance."
165,UI/UX Designer,"Our client is seeking a UI/UX Designer.   Location: Bethesda, MD Position Type: Full Time   Position overview - Do you live and breath e beautiful design?  - Do you look at every street sign, every advertisement, every website and wish you could make it more usable?  - Our client is looking for a highly talented, creative and innovative UX/UI Designer to join its product development team.  - We're looking for designers that want to make a real impact in early childhood education. - You will work closely with the development team to ensure that our platform is beautiful to look at and delightful to use.   Specific roles and responsibilities:  - Be a customer advocate for identifying and defining key application functionality, workflow and design - Works closely with product management and technology development to design a delightful user experience - Develops wireframes, storyboards and user personas to help guide the evolution of our platform - Performs usability and accessibility testing on our technology platform - Engages customers in open dialogue about functionality and design in the platform - Leads the definition and implementation of a user experience practice at the company   Qualifications: - Bachelor's degree in Computer Human Interaction, User Experience, or a related field - Minimum of five (5) years of hands-on experience in user experience design - Online portfolio of projects and designs you have worked on - Deep understanding of typography, layout, color and quality design - Understanding of HTML, Javascript and CSS fundamentals - Experience with usability testing, focus groups, customer outreach and prototyping - Experience with accessibility and 508 compliance - Patience, rigor, and the ability to communicate clearly - Highly collaborative work style"
166,Java Application Architect,"Job title: Java Application ArchitectLocation: SunnyvaleDuration: 12-24 moJob type: W2 or C2C Summary: Contact Center Technologies is looking for a Java Architect and developer with a strong trackrecord of executing highly cross functional projects.This person needs to have proven experience picking up new technologies, hands on development and communicating effectively. Key Qualifications:Design, develop and implement large-scale enterprise systems, built on enterprise level applications and services using Java.Implement architectural standards and frameworks, allowing for a flexible and scalable environment.Hands-on active Java development experience is must.Extensive experience with CassandraGood knowledge of concurrent and distributed application framework like AkkaWork with Queueing and caching solutions (JMS, Coherence, Timesten, etc…)Proven record of learining new technologiesAbility to manage development teams including code reviewsProvide best practices around application design, modeling, scalability and performance.Excellent communication, leadership and presentation skills. Experience:10+ years of experience in the software industryBS/BA degree or equivalent technical experienceExperience in Java application developmentExperience in services design and modelingExperience in a large scale enterprise application integration and development If interested, please send your resume to Rick Scott: rscott@sisinc.com Hand on Java Developer, Java Architect, Cassandra InformationPreferenceJavaTechnologies"
167,Business Analyst - Business Analyst healthcare,"Job Description: Business Analysst with Market Place or Insurance Broker Onboarding and Commissioning experience.Required Skills: BUSINESS ANALYST. Don't hesitate! Submit your resume today. SMCI is an EEO employer. All qualified applicants will receive consideration without regard to race, color, religion, sex, pregnancy, national origin, disability, age, genetic information, veteran status, sexual orientation and identity, AIDS/HIV, medical condition, political activities or affiliations, or status as a victim of domestic violence, assault, or stalking. (No third parties, please)(H1 sponsorship currently unavailable)(Local candidates only, please)"
169,"Network Administrator - Cisco UCS, VMware, Citrix, Windows","Job Description: Looking for a Lead IS Support Analyst 3 to provide advanced diagnosis and expert operational support in the US. The successful candidate will oversee the day to day operations and support for that West Coast Region and be responsible for driving projects and handling any escalations that require Management oversight.This role is ideal for a determined Technical Leader, who is able to work rapidly, decisively and independently but at the same time work closely together with his/her peers in other regions throughout the world. Expected to show initiative, with excellent communication skills at all levels with both non-technical and skilled technical staff. Contribute to and sometimes manage moderately complex aspects of a project. Will take direction from the Global Platforms support Manager. Interact with several other MIS organizations, including the Design Team, Service Delivery Teams and Project Teams. Must be able to demonstrate an organized and methodical approach to handling IT problems. Job Core Responsibilities Approve and implement change requests. Coordinate and drive works as it relates to Problem Management. Respond to operational and security escalations quickly and effectively and manage any Major incidents that need Level 3 involvement. Perform system maintenance and troubleshooting in a diversified technical and complex global environment. Ensure any major incidents follow process and appropriate root Cause Analysis and Problem Management are performed including identifying trends, proposing long term solutions implementing solutions. Provide technical leadership on projects, ensuring successful transition from infrastructure and design to production operational support. Work effectively in a team environment, sharing technical knowledge, solutions, and recommendations. Document processes and procedures clearly, thoroughly, and provide training.Requirements University degree in Computer Science, Engineering, or other technical field 10 plus years relevant IT experience o Experience with Flexpod o Cisco UCS/Networking o The core technologies we support, i.e Netapp, UCS, Nexus, Windows, AD, LDAP, VMware, cloud services, SIEM tools, monitoring tools. o Networking experience multi tenanted systems o Citrix experience Experience working in a multinational, multi-site environment Experience working in a regulated environment Experience writing processes and proceduresRequired Skills: CISCO ;LDAP; WINDOWS; CITRIX; NETAPP, AD, CLOUD SERVICES, MONITORING TOOLS; NETWORKING. Don't hesitate! Submit your resume today. SMCI is an EEO employer. All qualified applicants will receive consideration without regard to race, color, religion, sex, pregnancy, national origin, disability, age, genetic information, veteran status, sexual orientation and identity, AIDS/HIV, medical condition, political activities or affiliations, or status as a victim of domestic violence, assault, or stalking. (No third parties, please)(H1 sponsorship currently unavailable)(Local candidates only, please)"
170,Wireless/RF Network Engineer,"TAD PGS INC., is currently seeking a Wireless/RF Network Engineer for one of our clients in Bethesda, MD. **Candidate must have the ability to obtain and maintain a Public Trust Level 5 Clearance.** Job Responsibilities:Cisco router/switches, wireless access points (WAP), RF signaling and Air Magnet for signalingGather network requirements by interviewing agencies, federal staff and other contractors.Analyze network performance statistics to determine elements of the network designWork with vendors, carriers, and other staff and team members to arrive at the final design using industry best practicesProduce presentations, engineering design guides, migration plan, NOC procedures and other documents as directed by managementFollow established change procedures and implement the changesValidate and verify the proper functioning of the networkTrain and mentor other junior engineers in design, troubleshooting and maintenance activitiesBasic Hiring Criteria:7+ years of Hands-on experience is required in migrating and managing a diverse network and telecommunications domain with a large scope and complexity from a technical, functional and service delivery perspective.Bachelor’s Degree Computer Science or Electrical Engineering, 4 years of addition related experience will be considered in lieu of a degree2+ year experience working with Cisco ASR switches, Cisco, 2800, 3800, 4000, 7200 and 7600 series routers.2+ year experience working with Cisco Catalyst 2900, 4000, 6500, series switches. Nexus 5k,7K and 9K2+ year experience working with VLAN-S (802.1a, ISL), Trunking , Aggregation (EtherChannel, FastEtherchannel, Gigabit Etherchannel, PAgP), 802.1d bridging, spanning tree2+ year experience working with IPv6, BGP, EIGRP, RIP, OSPF, IPSECDesired Qualifications:Excellent knowledge of Internet technologies and networkingMust be a team player, have excellent oral and written communications skills, be customer service oriented and demonstrate ownership to issuesCertified Networking Professional like an Cisco CCNPGood knowledge of Native and Hybrid modes for Cisco networksTAD PGS, INC. specializes in delivering secure, reliable and rapidly implemented workforce solutions to the U.S. Federal marketplace, including U.S. Government agencies and their prime contractors. With more than 50 years of experience, TAD PGS, INC. has earned a reputation for accountability, a value that government agencies and prime contractors both demand and deserve.TAD PGS, INC. sources professionals for the full spectrum of federal positions, from administrative to management, and those contracts requiring extremely niche-oriented technical skills and the highest levels of security clearance."
171,Data Analyst,"One of our Big4 Client in California area is looking to hire an experienced Data Analyst with P&C (Property and Casualty) Insurance background.  This is a Contract to Hire role for 6 months initially to start.If interested please apply with your updated resume at apoorv.dubey@sumerusolutions.com.Job Description: Job Title:Data Analyst           Location:Los Angeles, CA          Duration:6 Months (Contract to Hire)  Travel: 80% (Friday Remote)Rate: Hourly + ExpensesRoles and responsibilities:Heavy P&C Insurance Industry backgroundIdeally will have Guidewire and Policy specific experience, but not a mandate. It will be a plus.Attend client meetings which includes program status reports, one off requests, mapping/modeling sessions as required, escalationKeep management informed/awareMaintain defined scopeManage and maneuver multiple work streams with interdependencies, but struggle with open lines of communicationsExperience with Data Mapping."
